[
  {
    "id": "bundle-records",
    "title": "The published content bundle — typed feeds + manifest (watermark export)",
    "scope": "bundle",
    "collection": "bundle",
    "status": "reviewed",
    "producer_kind": "derived",
    "command": "export",
    "connector_ref": "watermark.site.export",
    "source": "watermark export — assembled from the committed corpus + reference datasets",
    "external_url": null,
    "license": "Site content — CC BY 4.0 over public-record sources (see web/README.md)",
    "access_tier": "public",
    "site_scope": "slug-scoped",
    "cadence": "on-demand",
    "ttl_days": null,
    "last_refreshed": null,
    "tags": [
      "bundle",
      "export",
      "frontend"
    ],
    "storage": [],
    "observed": {
      "exists": true,
      "sha256": null,
      "size_bytes": 0,
      "lfs_materialized": true,
      "file_count": 0,
      "stale": false,
      "asof": null
    },
    "citation": {
      "source": "watermark export — assembled from the committed corpus + reference datasets",
      "source_kind": "derived",
      "page": null,
      "confidence": "medium",
      "note": "watermark export",
      "verified": false
    }
  },
  {
    "id": "onboard-bundle",
    "title": "Full site onboarding — every reach/economics connector, in dependency order",
    "scope": "derived",
    "collection": "derived",
    "status": "reviewed",
    "producer_kind": "derived",
    "command": null,
    "connector_ref": null,
    "source": "virtual aggregate — resolved by `watermark catalog run onboard-bundle --site <slug>`",
    "external_url": null,
    "license": null,
    "access_tier": "public",
    "site_scope": "slug-scoped",
    "cadence": "on-demand",
    "ttl_days": null,
    "last_refreshed": null,
    "tags": [
      "onboarding",
      "aggregate"
    ],
    "storage": [],
    "observed": {
      "exists": true,
      "sha256": null,
      "size_bytes": 0,
      "lfs_materialized": true,
      "file_count": 0,
      "stale": false,
      "asof": null
    },
    "citation": {
      "source": "virtual aggregate — resolved by `watermark catalog run onboard-bundle --site <slug>`",
      "source_kind": "derived",
      "page": null,
      "confidence": "medium",
      "note": null,
      "verified": false
    }
  },
  {
    "id": "data-centers",
    "title": "Per-Site Data-Center Activity Register",
    "scope": "extracted",
    "collection": "extracted",
    "status": "reviewed",
    "producer_kind": "manual",
    "command": null,
    "connector_ref": null,
    "source": "BOSC site-onboarding discovery — verified public-record register of per-site data-center activity (Columbus/New Albany/Springfield)",
    "external_url": null,
    "license": "Curated from cited public sources",
    "access_tier": "public",
    "site_scope": "slug-scoped",
    "cadence": "on-demand",
    "ttl_days": null,
    "last_refreshed": "2026-06-22",
    "tags": [
      "data-centers",
      "discovery",
      "onboarding",
      "per-site"
    ],
    "storage": [
      {
        "relpath": "extracted/{site}/data-centers.md",
        "media_type": "text/markdown",
        "lfs": false
      }
    ],
    "observed": {
      "exists": true,
      "sha256": "e611ec3cc39491e055f7a6c63c6a13383408516f2b59f898f84117c2dca73dbe",
      "size_bytes": 144471,
      "lfs_materialized": true,
      "file_count": 12,
      "stale": false,
      "asof": null
    },
    "citation": {
      "source": "BOSC site-onboarding discovery — verified public-record register of per-site data-center activity (Columbus/New Albany/Springfield)",
      "source_kind": "reference",
      "page": null,
      "confidence": "medium",
      "note": null,
      "verified": false
    }
  },
  {
    "id": "grid",
    "title": "Grid Reliability + Siting Extractions (PJM §202(c) dispatch; AEP Ohio Lyka 345kV project)",
    "scope": "extracted",
    "collection": "grid",
    "status": "reviewed",
    "producer_kind": "extracted",
    "command": null,
    "connector_ref": null,
    "source": "U.S. Department of Energy (CESER) FPA §202(c) emergency orders 202-26-33 / 202-26-32 and PJM Interconnection's underlying application — captured under data/documents/grid/pjm-202c-2026/; AEP Ohio's Lyka Transmission Project fact sheet + map — captured under data/documents/grid/aep-lyka-2026/",
    "external_url": null,
    "license": "Public record (federal agency order / regulatory filing); AEP Ohio public project materials",
    "access_tier": "public",
    "site_scope": "basin-shared",
    "cadence": "on-demand",
    "ttl_days": null,
    "last_refreshed": null,
    "tags": [
      "grid",
      "reliability-event",
      "backup-generation",
      "pjm",
      "section-202c",
      "dispatch",
      "opsb",
      "transmission",
      "siting"
    ],
    "storage": [
      {
        "relpath": "extracted/grid/pjm-202c-emergency-2026.event.yaml",
        "media_type": "application/x-yaml",
        "lfs": false
      },
      {
        "relpath": "extracted/grid/aep-lyka-transmission-2026.project.yaml",
        "media_type": "application/x-yaml",
        "lfs": false
      }
    ],
    "observed": {
      "exists": true,
      "sha256": "c4a18667231164be035c927365116d5ce692787aac05222c9c31b4ccfed1c44c",
      "size_bytes": 19814,
      "lfs_materialized": true,
      "file_count": 2,
      "stale": false,
      "asof": null
    },
    "citation": {
      "source": "U.S. Department of Energy (CESER) FPA §202(c) emergency orders 202-26-33 / 202-26-32 and PJM Interconnection's underlying application — captured under data/documents/grid/pjm-202c-2026/; AEP Ohio's Lyka Transmission Project fact sheet + map — captured under data/documents/grid/aep-lyka-2026/",
      "source_kind": "document",
      "page": null,
      "confidence": "medium",
      "note": null,
      "verified": true
    }
  },
  {
    "id": "legal-records-legislation",
    "title": "Public-Records Legislation — Sub. H.B. 314 (136th G.A.) Digest & Analysis",
    "scope": "extracted",
    "collection": "legal",
    "status": "reviewed",
    "producer_kind": "extracted",
    "command": null,
    "connector_ref": null,
    "source": "Ohio General Assembly / LSC (H.B. 314, 136th G.A. — As Introduced and As Passed by the House) + Project BOSC analysis — provision digest, introduced→passed diff, and relevance to the R.C. 149.43 PRR/mandamus posture",
    "external_url": null,
    "license": "Public record (Ohio legislative document)",
    "access_tier": "public",
    "site_scope": "state:OH",
    "cadence": "on-demand",
    "ttl_days": null,
    "last_refreshed": "2026-07-22",
    "tags": [
      "public-records",
      "legislation",
      "r.c.-149.43"
    ],
    "storage": [
      {
        "relpath": "extracted/legal/records-legislation/hb314-149-43.analysis.md",
        "media_type": "text/markdown",
        "lfs": false
      },
      {
        "relpath": "extracted/legal/records-legislation/hb314-149-43.digest.yaml",
        "media_type": "application/x-yaml",
        "lfs": false
      }
    ],
    "observed": {
      "exists": true,
      "sha256": "70d428fb3c6f8ebe196bae050b7f76db312811b89f0b22a437012ab19ec17ef2",
      "size_bytes": 31430,
      "lfs_materialized": true,
      "file_count": 2,
      "stale": false,
      "asof": null
    },
    "citation": {
      "source": "Ohio General Assembly / LSC (H.B. 314, 136th G.A. — As Introduced and As Passed by the House) + Project BOSC analysis — provision digest, introduced→passed diff, and relevance to the R.C. 149.43 PRR/mandamus posture",
      "source_kind": "document",
      "page": null,
      "confidence": "medium",
      "note": null,
      "verified": true
    }
  },
  {
    "id": "meetings",
    "title": "Per-Site Civic Meeting Records (Slug-Scoped)",
    "scope": "extracted",
    "collection": "meetings",
    "status": "reviewed",
    "producer_kind": "connector",
    "command": "subdivisions download",
    "connector_ref": "watermark.civic",
    "source": "Per-site governing bodies (e.g. City of Lima council) — published meeting documents, scraped per watershed-point site",
    "external_url": null,
    "license": "Public record (Ohio R.C. 149.43)",
    "access_tier": "public",
    "site_scope": "slug-scoped",
    "cadence": "on-demand",
    "ttl_days": null,
    "last_refreshed": "2026-06-08",
    "tags": [
      "civic",
      "meetings",
      "per-site",
      "slug-scoped"
    ],
    "storage": [
      {
        "relpath": "extracted/{site}/meetings/download-manifest.yaml",
        "media_type": "application/x-yaml",
        "lfs": false
      },
      {
        "relpath": "extracted/{site}/meetings/meeting-index.yaml",
        "media_type": "application/x-yaml",
        "lfs": false
      }
    ],
    "observed": {
      "exists": true,
      "sha256": "120e7875d271cb9ee515ae71e986aa3dad1317f69af21c26dea9c0494007980c",
      "size_bytes": 46166,
      "lfs_materialized": true,
      "file_count": 2,
      "stale": false,
      "asof": null
    },
    "citation": {
      "source": "Per-site governing bodies (e.g. City of Lima council) — published meeting documents, scraped per watershed-point site",
      "source_kind": "connector",
      "page": null,
      "confidence": "medium",
      "note": "watermark subdivisions download",
      "verified": true
    }
  },
  {
    "id": "abatement-parameters",
    "title": "Coshocton County, OH Abatement Parameters + What-If Scenario Knobs",
    "scope": "reference",
    "collection": "economics",
    "status": "reviewed",
    "producer_kind": "manual",
    "command": null,
    "connector_ref": null,
    "source": "Ohio Revised Code (5715.01 assessment ratio; 122.175 DCTE scope; 3735.671(A)(2) school-compensation floor) + Ohio Department of Taxation county sales-and-use rate + a stated commercial-millage assumption; the withheld-knob bands are cross-referenced to reference/datacenter-industry/priors.yaml",
    "external_url": null,